[
  {
    "行": 2,
    "类型": "场景行",
    "场景": "场景1-1",
    "句": [],
    "镜头": [
      "E01-K001"
    ],
    "动作": []
  },
  {
    "行": 3,
    "类型": "人物行",
    "场景": "场景1-1",
    "句": [],
    "镜头": [
      "E01-K001"
    ],
    "动作": []
  },
  {
    "行": 4,
    "类型": "△",
    "场景": "场景1-1",
    "句": [],
    "镜头": [
      "E01-K001"
    ],
    "动作": [
      "E01-A0001"
    ]
  },
  {
    "行": 5,
    "类型": "对白",
    "场景": "场景1-1",
    "句": [
      "E01-S001"
    ],
    "镜头": [
      "E01-K002"
    ],
    "动作": [
      "E01-A0002"
    ]
  },
  {
    "行": 6,
    "类型": "△",
    "场景": "场景1-1",
    "句": [],
    "镜头": [
      "E01-K003"
    ],
    "动作": []
  },
  {
    "行": 7,
    "类型": "对白",
    "场景": "场景1-1",
    "句": [
      "E01-S002"
    ],
    "镜头": [
      "E01-K003"
    ],
    "动作": []
  },
  {
    "行": 8,
    "类型": "△",
    "场景": "场景1-1",
    "句": [],
    "镜头": [
      "E01-K004"
    ],
    "动作": [
      "E01-A0003"
    ]
  },
  {
    "行": 9,
    "类型": "对白",
    "场景": "场景1-1",
    "句": [
      "E01-S003"
    ],
    "镜头": [
      "E01-K004"
    ],
    "动作": [
      "E01-A0004"
    ]
  }
]
